{
  "feature_id": "priority-introductions",
  "checkpoint_days": 30,
  "brief_version": "1.2.0",
  "generated_by": "monitoring-coordinator",
  "window": {
    "post_start": "2026-05-04",
    "post_end": "2026-06-02",
    "pre_start": "2026-04-04",
    "pre_end": "2026-05-03",
    "complete": true
  },
  "segments_checked": [
    "platform",
    "market",
    "platform x market",
    "user_type",
    "assignment",
    "subscription_status"
  ],
  "guardrail_status": {
    "overall": "warn",
    "items": [
      {
        "metric": "report_block_rate",
        "status": "warn",
        "worst_segment": "Android/GB",
        "evidence_refs": [
          "EV-GRD-report-block-rate-d30"
        ]
      },
      {
        "metric": "day7_retention_proxy",
        "status": "warn",
        "worst_segment": "iOS/DE",
        "evidence_refs": [
          "EV-GRD-day7-retention-proxy-d30"
        ]
      },
      {
        "metric": "payment_completion_rate",
        "status": "pass",
        "worst_segment": "Android/GB",
        "evidence_refs": [
          "EV-GRD-payment-completion-rate-d30"
        ]
      }
    ]
  },
  "instrumentation_health": {
    "status": "healthy",
    "events_below_floor": [],
    "metrics_not_trustworthy": [],
    "evidence_refs": [
      "EV-INS-summary-d30"
    ]
  },
  "primary_outcome": {
    "metric": "mutual_connection_rate",
    "checkpoint_value": 0.183453,
    "treatment_vs_control_relative_pct": 0.5662,
    "expected_range_pct": [
      2.0,
      4.0
    ],
    "verdict": "no_detectable_change",
    "evidence_refs": [
      "EV-MOV-mutual-connection-rate-d30"
    ]
  },
  "executive_summary": "Day-30 checkpoint on Priority Introductions shows no detectable aggregate effect: mutual_connection_rate is 0.5662% treatment vs control, below the 1.2% minimum detectable effect. That aggregate is misleading. iOS/DE treatment users show a -8.3766% decline in mutual_connection_rate with no equivalent movement in the control arm, which is consistent with a genuine feature effect in that market and may be offsetting gains elsewhere. Instrumentation is healthy across all events, so this is unlikely to be a measurement artefact. Escalating for a human decision on whether to hold the German iOS rollout.",
  "segment_findings": [
    {
      "segment": "iOS/DE",
      "observation": "mutual_connection_rate in iOS/DE moved -8.3766% over the window, accounting for 38.9% of total absolute movement. The treatment arm moved -16.4961% against -0.3069% in control.",
      "arm_symmetry": "treatment_only",
      "evidence_refs": [
        "EV-SEG-mutual-connection-rate-platform-market-ios-de-d30",
        "EV-SEG-mutual-connection-rate-platform-market-d30"
      ],
      "confidence": "medium",
      "limitations": "Single market and platform; no qualitative signal on why German users respond differently. Sub-segment cell sizes below the market level are not examined."
    }
  ],
  "facts": [
    {
      "statement": "Aggregate mutual_connection_rate is 0.5662% treatment vs control, below the 1.2% minimum detectable effect.",
      "evidence_refs": [
        "EV-MOV-mutual-connection-rate-d30"
      ]
    },
    {
      "statement": "mutual_connection_rate in iOS/DE fell 8.3766% over the window, with the movement confined to the treatment arm.",
      "evidence_refs": [
        "EV-SEG-mutual-connection-rate-platform-market-ios-de-d30"
      ]
    },
    {
      "statement": "Every critical event is above the 95% completeness floor in all eligible markets, so no metric in this checkpoint is compromised by measurement.",
      "evidence_refs": [
        "EV-INS-summary-d30"
      ]
    },
    {
      "statement": "day7_retention_proxy is 0.1861% treatment vs control in aggregate and within its guardrail threshold.",
      "evidence_refs": [
        "EV-MOV-day7-retention-proxy-d30"
      ]
    }
  ],
  "hypotheses": [
    {
      "statement": "Priority Introductions may suppress mutual connections for German iOS users, possibly through introduction ranking that suits the local liquidity pattern poorly.",
      "supporting_evidence_refs": [
        "EV-SEG-mutual-connection-rate-platform-market-ios-de-d30"
      ],
      "contradicting_evidence_refs": [
        "EV-MOV-mutual-connection-rate-d30"
      ],
      "confidence": "medium",
      "how_to_test": "Compare intro acceptance rate by recipient bucket within iOS/DE treatment against iOS/US treatment; if ranking is the mechanism, acceptance should differ.",
      "ruled_out": false
    },
    {
      "statement": "The iOS/DE movement could be a market-specific seasonal or competitive effect unrelated to the feature.",
      "supporting_evidence_refs": [],
      "contradicting_evidence_refs": [
        "EV-SEG-mutual-connection-rate-platform-market-ios-de-d30"
      ],
      "confidence": "low",
      "how_to_test": "An external effect would move the control arm too. Control moved -0.3069%, which argues against this.",
      "ruled_out": false
    }
  ],
  "recommended_actions": [
    {
      "action": "Hold the German iOS rollout at its current share pending a ranking review.",
      "owner": "product-discovery",
      "rationale": "A treatment-only decline of this size in one market is worth pausing on, and the aggregate does not justify expanding.",
      "blocks_product_decision": true,
      "evidence_refs": [
        "EV-SEG-mutual-connection-rate-platform-market-ios-de-d30"
      ]
    },
    {
      "action": "Run the intro acceptance comparison for iOS/DE against iOS/US within treatment.",
      "owner": "lifecycle-analytics",
      "rationale": "Cheapest test that separates a ranking mechanism from a market effect.",
      "blocks_product_decision": false,
      "evidence_refs": [
        "EV-SEG-mutual-connection-rate-platform-market-ios-de-d30"
      ]
    }
  ],
  "confidence_and_escalation": {
    "overall_confidence": "medium",
    "escalate": true,
    "escalation_reasons": [
      "Aggregate primary outcome does not clear the 1.2% minimum detectable effect.",
      "A treatment-only decline in iOS/DE requires a product decision on the German rollout."
    ],
    "escalation_route": "#analytics-launch-review (fictional)"
  },
  "evidence_index": [
    {
      "evidence_id": "EV-GRD-day7-retention-proxy-d30",
      "tool": "guardrail_check",
      "summary": "Deterministic tool output cited by this report."
    },
    {
      "evidence_id": "EV-GRD-payment-completion-rate-d30",
      "tool": "guardrail_check",
      "summary": "Deterministic tool output cited by this report."
    },
    {
      "evidence_id": "EV-GRD-report-block-rate-d30",
      "tool": "guardrail_check",
      "summary": "Deterministic tool output cited by this report."
    },
    {
      "evidence_id": "EV-INS-summary-d30",
      "tool": "instrumentation_check",
      "summary": "Deterministic tool output cited by this report."
    },
    {
      "evidence_id": "EV-MOV-day7-retention-proxy-d30",
      "tool": "metric_movement",
      "summary": "Deterministic tool output cited by this report."
    },
    {
      "evidence_id": "EV-MOV-mutual-connection-rate-d30",
      "tool": "metric_movement",
      "summary": "Deterministic tool output cited by this report."
    },
    {
      "evidence_id": "EV-SEG-mutual-connection-rate-platform-market-d30",
      "tool": "segment_breakdown",
      "summary": "Deterministic tool output cited by this report."
    },
    {
      "evidence_id": "EV-SEG-mutual-connection-rate-platform-market-ios-de-d30",
      "tool": "segment_breakdown",
      "summary": "Deterministic tool output cited by this report."
    }
  ]
}
