{
  "feature_id": "priority-introductions",
  "checkpoint_days": 30,
  "brief_version": "1.2.0",
  "generated_by": "monitoring-coordinator",
  "window": {
    "post_start": "2026-05-04",
    "post_end": "2026-06-02",
    "pre_start": "2026-04-04",
    "pre_end": "2026-05-03",
    "complete": true
  },
  "segments_checked": [
    "platform",
    "market",
    "platform x market",
    "user_type",
    "assignment",
    "subscription_status"
  ],
  "guardrail_status": {
    "overall": "warn",
    "items": [
      {
        "metric": "report_block_rate",
        "status": "warn",
        "worst_segment": "iOS/US",
        "evidence_refs": [
          "EV-GRD-report-block-rate-d30"
        ]
      },
      {
        "metric": "day7_retention_proxy",
        "status": "pass",
        "worst_segment": "Android/GB",
        "evidence_refs": [
          "EV-GRD-day7-retention-proxy-d30"
        ]
      },
      {
        "metric": "payment_completion_rate",
        "status": "pass",
        "worst_segment": "Android/CA",
        "evidence_refs": [
          "EV-GRD-payment-completion-rate-d30"
        ]
      }
    ]
  },
  "instrumentation_health": {
    "status": "healthy",
    "events_below_floor": [],
    "metrics_not_trustworthy": [],
    "evidence_refs": [
      "EV-INS-summary-d30"
    ]
  },
  "primary_outcome": {
    "metric": "mutual_connection_rate",
    "checkpoint_value": 0.185118,
    "treatment_vs_control_relative_pct": 2.6817,
    "expected_range_pct": [
      2.0,
      4.0
    ],
    "verdict": "within_expected_range",
    "evidence_refs": [
      "EV-MOV-mutual-connection-rate-d30"
    ]
  },
  "executive_summary": "Day-30 checkpoint on Priority Introductions: the primary outcome is healthy at 2.6817% treatment vs control. Subscription conversion in Android/GB fell 10.9881% over the window, and the decline is real \u2014 the funnel moves at checkout and stays down through activation, and instrumentation is healthy. It cannot be attributed to Priority Introductions: the movement appears in the control arm at -9.5416% against -12.3748% in treatment, and EXP-4502, a single-page checkout redesign, is running on 60% of exactly this segment for exactly this period. Two explanations remain live and this checkpoint cannot separate them. Escalating.",
  "segment_findings": [
    {
      "segment": "Android/GB",
      "observation": "subscription_conversion_rate in Android/GB fell 10.9881% over the window and 11.7792% half-over-half. Treatment moved -12.3748% and control -9.5416%. The movement is present in the control arm at a comparable magnitude. A feature shipped only to treatment cannot cause this. Look for a release, a payment processor, or a measurement change affecting both arms.",
      "arm_symmetry": "symmetric_across_arms",
      "evidence_refs": [
        "EV-SEG-subscription-conversion-rate-platform-market-android-gb-d30",
        "EV-SEG-subscription-conversion-rate-platform-market-d30"
      ],
      "confidence": "high",
      "limitations": "The overlapping experiment covers 60% of this cell, so the residual attributable to anything else cannot be isolated from this data alone."
    }
  ],
  "facts": [
    {
      "statement": "subscription_conversion_rate in Android/GB fell 10.9881% over the checkpoint window.",
      "evidence_refs": [
        "EV-SEG-subscription-conversion-rate-platform-market-android-gb-d30"
      ]
    },
    {
      "statement": "The Android/GB movement is present in both arms: -12.3748% in treatment and -9.5416% in control.",
      "evidence_refs": [
        "EV-SEG-subscription-conversion-rate-platform-market-android-gb-d30"
      ]
    },
    {
      "statement": "EXP-4502, a single-page checkout redesign, is running on 60% of Android/GB free users across the whole checkpoint window, with subscription_conversion_rate as its own primary metric.",
      "evidence_refs": [
        "EV-CTX-experiment-exp-4502"
      ]
    },
    {
      "statement": "Every critical event is above the 95% completeness floor in Android/GB, so the movement is not a measurement artefact.",
      "evidence_refs": [
        "EV-INS-summary-d30"
      ]
    },
    {
      "statement": "mutual_connection_rate is 2.6817% treatment vs control, inside the contract's expected range.",
      "evidence_refs": [
        "EV-MOV-mutual-connection-rate-d30"
      ]
    }
  ],
  "hypotheses": [
    {
      "statement": "EXP-4502's checkout redesign may account for the Android/GB conversion decline; it covers 60% of the cell and targets the same metric.",
      "supporting_evidence_refs": [
        "EV-CTX-experiment-exp-4502",
        "EV-SEG-subscription-conversion-rate-platform-market-android-gb-d30"
      ],
      "contradicting_evidence_refs": [],
      "confidence": "medium",
      "how_to_test": "Split Android/GB by EXP-4502 assignment. If the decline is concentrated in its treatment cells, EXP-4502 is the explanation.",
      "ruled_out": false
    },
    {
      "statement": "A market-level factor affecting all Android/GB users could explain the movement, since it is present in both arms of this experiment.",
      "supporting_evidence_refs": [
        "EV-SEG-subscription-conversion-rate-platform-market-android-gb-d30"
      ],
      "contradicting_evidence_refs": [],
      "confidence": "medium",
      "how_to_test": "Check whether iOS/GB conversion moved over the same period. A market factor should not be confined to one platform.",
      "ruled_out": false
    },
    {
      "statement": "Priority Introductions could have contributed to the decline by diverting attention from the paywall.",
      "supporting_evidence_refs": [],
      "contradicting_evidence_refs": [
        "EV-SEG-subscription-conversion-rate-platform-market-android-gb-d30"
      ],
      "confidence": "low",
      "how_to_test": "A treatment-only effect would not appear in control. Control fell -9.5416%, which largely rules this out as the main driver.",
      "ruled_out": true
    }
  ],
  "recommended_actions": [
    {
      "action": "Do not attribute the Android/GB conversion decline to Priority Introductions in any onward reporting until EXP-4502 assignment is separated out.",
      "owner": "lifecycle-analytics",
      "rationale": "The movement is symmetric across arms and an overlapping experiment covers 60% of the cell. Attribution is not available from this checkpoint.",
      "blocks_product_decision": true,
      "evidence_refs": [
        "EV-SEG-subscription-conversion-rate-platform-market-android-gb-d30",
        "EV-CTX-experiment-exp-4502"
      ]
    },
    {
      "action": "Split Android/GB conversion by EXP-4502 assignment with the monetization analytics owner.",
      "owner": "monetization-analytics",
      "rationale": "Cheapest test that would separate the two live explanations.",
      "blocks_product_decision": false,
      "evidence_refs": [
        "EV-CTX-experiment-exp-4502"
      ]
    }
  ],
  "confidence_and_escalation": {
    "overall_confidence": "medium",
    "escalate": true,
    "escalation_reasons": [
      "Two explanations for the Android/GB decline remain live at comparable confidence, and this checkpoint cannot separate them.",
      "EXP-4502 covers 60% of the affected segment, so clean attribution is unavailable."
    ],
    "escalation_route": "#analytics-launch-review (fictional)"
  },
  "evidence_index": [
    {
      "evidence_id": "EV-CTX-experiment-exp-4502",
      "tool": "launch_context",
      "summary": "Deterministic tool output cited by this report."
    },
    {
      "evidence_id": "EV-GRD-day7-retention-proxy-d30",
      "tool": "guardrail_check",
      "summary": "Deterministic tool output cited by this report."
    },
    {
      "evidence_id": "EV-GRD-payment-completion-rate-d30",
      "tool": "guardrail_check",
      "summary": "Deterministic tool output cited by this report."
    },
    {
      "evidence_id": "EV-GRD-report-block-rate-d30",
      "tool": "guardrail_check",
      "summary": "Deterministic tool output cited by this report."
    },
    {
      "evidence_id": "EV-INS-summary-d30",
      "tool": "instrumentation_check",
      "summary": "Deterministic tool output cited by this report."
    },
    {
      "evidence_id": "EV-MOV-mutual-connection-rate-d30",
      "tool": "metric_movement",
      "summary": "Deterministic tool output cited by this report."
    },
    {
      "evidence_id": "EV-SEG-subscription-conversion-rate-platform-market-android-gb-d30",
      "tool": "segment_breakdown",
      "summary": "Deterministic tool output cited by this report."
    },
    {
      "evidence_id": "EV-SEG-subscription-conversion-rate-platform-market-d30",
      "tool": "segment_breakdown",
      "summary": "Deterministic tool output cited by this report."
    }
  ]
}
